{
  "$schema": "https://json-schema.org/draft/2020-12/schema",
  "$id": "https://house-builder.local/schemas/brand.schema.json",
  "title": "Brand",
  "type": "object",
  "required": ["slug", "name", "tier", "categories"],
  "additionalProperties": false,
  "properties": {
    "slug": { "type": "string", "pattern": "^[a-z0-9]+(?:-[a-z0-9]+)*$" },
    "name": { "type": "string", "minLength": 1 },
    "aliases": { "type": "array", "items": { "type": "string" } },
    "categories": { "type": "array", "items": { "type": "string" }, "minItems": 1 },
    "tier": {
      "type": "string",
      "enum": ["entry", "mainstream", "first_line", "premium"],
      "description": "入门 / 主流 / 一线 / 高端"
    },
    "summary": { "type": "string" },
    "source": { "type": "string", "enum": ["seed", "enrich", "editor"] },
    "confidence": { "type": "number", "minimum": 0, "maximum": 1 }
  }
}
